{
  "schema_version": "1.0",
  "manifest_id": "apt_0000000000000003",
  "manifest_hash": "sha256:0000000000000000000000000000000000000000000000000000000000000003",
  "generated_at": "2026-04-18T00:00:00Z",
  "incomplete": false,
  "task": {
    "task_id": "tsk_abcdef0123456789",
    "source": "<inline>",
    "raw_text": "hello",
    "type": "feature",
    "objective": "hello",
    "anchors": [],
    "expects_tests": false,
    "expects_config": false,
    "expects_docs": false,
    "expects_migration": false,
    "expects_api_contract": false
  },
  "repo": {"root": "/tmp/x", "fingerprint": "sha256:aaaa", "language_hints": ["go"]},
  "budget": {
    "model": "claude-sonnet-4-6",
    "token_ceiling": 200000,
    "reserved": {"instructions": 0, "reasoning": 0, "tool_output": 0, "expansion": 0},
    "effective_context_budget": 152000,
    "estimated_selected_tokens": 0,
    "estimator": "heuristic-3.5",
    "estimator_version": "v1"
  },
  "selections": [
    {
      "path": "added.go",
      "kind": "file",
      "load_mode": "full",
      "relevance_score": 0.7,
      "score_breakdown": [],
      "estimated_tokens": 100,
      "rationale": [],
      "side_effects": []
    }
  ],
  "reachable": [],
  "exclusions": [],
  "gaps": [],
  "feasibility": {
    "score": 0.0,
    "assessment": "ok",
    "positives": [],
    "negatives": [],
    "blocking_conditions": [],
    "sub_signals": {}
  },
  "generation_metadata": {
    "aperture_version": "1.1.0",
    "selection_logic_version": "sel-v2",
    "config_digest": "sha256:cfg1",
    "side_effect_tables_version": "side-effect-tables-v1",
    "host": "h",
    "pid": 1,
    "wall_clock_started_at": "2026-04-18T00:00:00Z"
  }
}
